{
  "type": "counterfactual-simulation-report-v1",
  "proposal_id": "example-portable-emulation-clarification",
  "generated_at": "2026-04-26T01:04:25Z",
  "authority": {
    "recordAuthority": "none",
    "gateEffect": "none",
    "mergeAuthority": "none",
    "simulationOnly": true
  },
  "input_summary": {
    "proposal_kind": "portable_emulation",
    "target_paths": [
      "docs/portability/emulation/README.md",
      "docs/portability/emulation/behavior-spec/v1-proposal-envelope.md"
    ],
    "target_surfaces": [
      "WORK"
    ],
    "proposed_change_summary": "Clarify that portable emulation proposal envelopes are proposal-only, require human review, and cannot claim Record, gate, or merge authority.",
    "evidence_refs": [
      "docs/portability/emulation/README.md",
      "docs/authority-values.md",
      "schema-registry/emulation-bundle-envelope.v1.json"
    ],
    "operator_question": "Does this clarification preserve portable-emulation authority boundaries?",
    "has_patch_text": true
  },
  "affected_paths": [
    "docs/portability/emulation/README.md",
    "docs/portability/emulation/behavior-spec/v1-proposal-envelope.md"
  ],
  "affected_surfaces": [
    "WORK"
  ],
  "possible_contradictions": [
    "Proposal references Record surfaces directly; verify the target surface and merge path are explicit."
  ],
  "doctrine_drift_risks": [],
  "follow_up_required": [
    "Review nearby documentation cross-links and terminology alignment around docs/portability/emulation/README.md.",
    "Re-check portable emulation authority wording and validation around docs/portability/emulation/README.md.",
    "Review nearby documentation cross-links and terminology alignment around docs/portability/emulation/behavior-spec/v1-proposal-envelope.md.",
    "Re-check portable emulation authority wording and validation around docs/portability/emulation/behavior-spec/v1-proposal-envelope.md."
  ],
  "tests_or_audits_to_run": [
    "pytest tests/test_emulation_contract_schema.py tests/test_emulation_bundle_schema.py"
  ],
  "recommendation": {
    "decision": "accept",
    "rationale": "The proposal is narrow, non-authoritative, and does not trigger obvious doctrine or contradiction risks."
  },
  "warnings": [
    "Advisory only: this simulation report is not evidence, not Record, not approval, and not a merge receipt."
  ]
}
